{
	"$schema": "../../section.schema.json",
	"name": "Deals",
	"icon": "tag",
	"settings": [
		{
			"id": "heading",
			"type": "text",
			"label": "Heading",
			"translatable": true,
			"default": "Blockbuster deals"
		},
		{
			"id": "link_label",
			"type": "text",
			"label": "Link label",
			"translatable": true,
			"default": "See all deals"
		},
		{
			"id": "link_url",
			"type": "url",
			"label": "Link",
			"default": "",
			"info": "Empty links to all products"
		}
	],
	"blocks": {
		"pick": {
			"name": "Product",
			"icon": "tag",
			"settings": [
				{
					"id": "product",
					"type": "product",
					"label": "Product",
					"default": ""
				}
			]
		}
	},
	"presets": [
		{
			"name": "Deals"
		}
	]
}
