{
	"$schema": "../../section.schema.json",
	"name": "Collection collage",
	"icon": "image",
	"settings": [
		{
			"id": "image_1",
			"type": "image",
			"label": "Image 1",
			"default": "",
			"info": "Empty uses the bundled collage image"
		},
		{
			"id": "image_2",
			"type": "image",
			"label": "Image 2",
			"default": "",
			"info": "Empty uses the bundled collage image"
		},
		{
			"id": "image_3",
			"type": "image",
			"label": "Image 3",
			"default": "",
			"info": "Empty uses the bundled collage image"
		},
		{
			"id": "image_4",
			"type": "image",
			"label": "Image 4",
			"default": "",
			"info": "Empty uses the bundled collage image"
		},
		{
			"id": "image_5",
			"type": "image",
			"label": "Image 5",
			"default": "",
			"info": "Empty uses the bundled collage image"
		}
	],
	"presets": [
		{
			"name": "Collection collage"
		}
	]
}
