{
	"$schema": "../../section.schema.json",
	"name": "Category strip",
	"icon": "columns",
	"settings": [
		{
			"id": "heading",
			"type": "text",
			"label": "Heading",
			"translatable": true,
			"default": "Featured Categories"
		},
		{
			"id": "description",
			"type": "textarea",
			"label": "Description",
			"translatable": true,
			"default": ""
		}
	],
	"blocks": {
		"category": {
			"name": "Category",
			"icon": "folder",
			"settings": [
				{
					"id": "image",
					"type": "image",
					"label": "Image",
					"default": ""
				},
				{
					"id": "heading",
					"type": "text",
					"label": "Heading",
					"translatable": true,
					"default": ""
				},
				{
					"id": "url",
					"type": "url",
					"label": "Link",
					"default": "",
					"info": "Empty links to all products"
				}
			]
		}
	},
	"presets": [
		{
			"name": "Category strip"
		}
	]
}
